### ISSUE TITLE
Why standby vault nodes uses a wide rang of ports?

### ISSUE THREAD

**Issue by Milad-Irani** [hashicorp/vault#3886]
Hi,

I have 2 vault nodes in HA mode, node A ( Mode: active - IP: a.a.a.a )  and node B ( Mode: standby - IP: b.b.b.b ).

**The security rules are defined as below:**
resource "openstack_networking_secgroup_rule_v2" "security_rule_vault_01" {
  direction = "ingress"
  ethertype = "IPv4"
  protocol = "tcp"
  port_range_min = 8200
  port_range_max = 8201
}

resource "openstack_networking_secgroup_rule_v2" "security_rule_vault_02" {
  direction = "ingress"
  ethertype = "IPv4"
  protocol = "tcp"
  port_range_min = 8300
  port_range_max = 8303
}

resource "openstack_networking_secgroup_rule_v2" "security_rule_vault_03" {
  direction = "egress"
  ethertype = "IPv4"
  protocol = "tcp"
  port_range_min = 8300
  port_range_max = 8303
}

resource "openstack_networking_secgroup_rule_v2" "security_rule_vault_06" {
  direction = "ingress"
  ethertype = "IPv4"
  protocol = "tcp"
  port_range_min = 8500
  port_range_max = 8500
}

**Configuration file on Vault instances is like:**
{
    "storage": {
        "consul": {
            "address": "127.0.0.1:8500",
            "redirect_addr": "http://nodeIP:8200",
            "path": "vault",
            "service": "vault"
        }
    },
    "listener": {
        "tcp": {
            "address": "0.0.0.0:8200",
            "tls_disable": 1
        }
    }
}

Vault is correctly unsealed and works fine on the Active node. However, the above security rules look insufficient to establish connection between Standby and Active node.
user@Standby-Node: vault list secret/
_Error reading secret/: Get http://a.a.a.a:8200/v1/secret?list=true: dial tcp a.a.a.a:8200: i/o timeout_

But as soon as I define a rule such as below, everything works smoothly.
resource "openstack_networking_secgroup_rule_v2" "security_rule_vault_06" {
  direction = "ingress"
  ethertype = "IPv4"
  protocol = "tcp"
  port_range_min = 1
  port_range_max = 65535
}

I used tcpdump tool to monitor traffic between these two. Output looks strange to me, since Vault is using a wide range of ports for communication between Standby and Active node.

IP b.b.b.b.8301 > a.a.a.a.8301: UDP, length 25
IP b.b.b.b.48878 > a.a.a.a.8201: Flags [P.], seq 3499978702:3499978967, ack 4011717061, win 529, options 2208109], length 265
IP a.a.a.a.8201 > b.b.b.b.48878: Flags [P.], seq 1:43, ack 265, win 527, options [nop,nop,TS val 2210071 
IP b.b.b.b.48878 > a.a.a.a.8201: Flags [.], ack 43, win 529, options [nop,nop,TS val 2214260 ecr 2210071]
IP a.a.a.a.8201 > b.b.b.b.48878: Flags [P.], seq 43:86, ack 265, win 527, options [nop,nop,TS val 2210072
IP b.b.b.b.48878 > a.a.a.a.8201: Flags [.], ack 86, win 529, options [nop,nop,TS val 2214261 ecr 2210072]
IP a.a.a.a.8201 > b.b.b.b.59568: Flags [P.], seq 86:375, ack 265, win 527, options [nop,nop,TS val 221007
IP b.b.b.b.59568 > a.a.a.a.8201: Flags [.], ack 375, win 544, options [nop,nop,TS val 2214261 ecr 2210072
IP b.b.b.b.59568 > a.a.a.a.8201: Flags [P.], seq 265:324, ack 375, win 544, options [nop,nop,TS val 22142
IP a.a.a.a.8201 > b.b.b.b.59568: Flags [P.], seq 375:414, ack 324, win 527, options [nop,nop,TS val 22100
IP b.b.b.b.8301 > a.a.a.a.8301: UDP, length 25

It is confusing and I dont want to simply open all ports on the VMs. Please let me know if I am doing something wrong.

Cheers,
Milad

**Comment by jefferai** [comment]
Hello,

8301 isn't Vault, it's Consul. Vault uses two ports (both changeable): 8200 and 8201. 8200 is used for API traffic; 8201 is used for cluster traffic.

**Comment by Milad-Irani** [comment]
Hey Jeff,

But the problem is still there. Why these two instances cannot communicate while all necessary ports are open? what about the tcpdump output?

**Comment by jefferai** [comment]
I don't know anything about OpenStack network/firewall rules, but my guess is that you're opening the right destination ports but you're restricting source ports.
